{"$schema":"https://json-schema.org/draft/2020-12/schema","type":"object","required":["id","title","question","evidence_plan","gates"],"properties":{"id":{"type":"string"},"title":{"type":"string","minLength":1},"question":{"type":"string","minLength":1},"evidence_plan":{"type":"string","minLength":1},"gates":{"type":"object","required":["safety","ethics","license","data","evaluator","resource","evidence"],"additionalProperties":{"type":"boolean"}}}}